"id","project_id","owner_id","type","title","description","target_audience","total_duration","fps","output_format","brand","scenes","assets","progress","status","render_id","bucket_name","output_url","created_at","updated_at","history","quality_report","quality_tier"
"68","proj_1769285135903_qbf15mkbz","40154188","product","Whole Body Health Approach","""Your health journey is unique—and your care should be too.""
Struggling with fatigue, hormones, or gut issues? You're not alone
At Pine Hill Farm, we dig deeper—addressing root causes, not just symptoms.
With at-home lab testing and personalized guidance from our functional nurse...
...you'll finally get the answers you've been searching for. 
Schedule your consultation today. Your wellness journey starts here.
","Adults 35 and up","46","30","{""platform"":""youtube"",""resolution"":{""width"":1920,""height"":1080},""aspectRatio"":""16:9""}","{""name"":""Pine Hill Farm"",""fonts"":{""body"":""Open Sans, Helvetica, sans-serif"",""weight"":{""body"":400,""heading"":700},""heading"":""Playfair Display, Georgia, serif""},""colors"":{""text"":""#5e637a"",""accent"":""#c9a227"",""primary"":""#2d5a27"",""secondary"":""#607e66"",""textLight"":""#ffffff""},""logoUrl"":"""",""watermarkOpacity"":0.3,""watermarkPosition"":""bottom-right""}","[{""id"":""scene_001_hook"",""type"":""hook"",""order"":1,""assets"":{""imageUrl"":""https://remotionlambda-useast1-refjo5giq5.s3.us-east-1.amazonaws.com/video-assets/images/content_scene_001_hook_1769285813341.jpg"",""videoUrl"":""https://remotionlambda-useast1-refjo5giq5.s3.us-east-1.amazonaws.com/ai-videos/kling-2.6/1769285368671_n5x4w3esn.mp4"",""videoSource"":""kling-2.6"",""productOverlayPosition"":{""x"":""right"",""y"":""bottom"",""scale"":0.25,""animation"":""fade""}},""analysis"":{""mood"":""serious"",""faces"":{""count"":1,""detected"":true,""positions"":[{""x"":60,""y"":20,""width"":25,""height"":35}]},""safeZones"":{""topLeft"":true,""topRight"":false,""topCenter"":false,""bottomLeft"":true,""middleLeft"":true,""bottomRight"":true,""middleRight"":false,""bottomCenter"":true,""middleCenter"":false},""composition"":{""brightness"":""bright"",""focalPoint"":{""x"":70,""y"":40},""dominantColors"":[""#f5f2ed"",""#e8ddd0"",""#c4b8a8""]},""contentType"":""person"",""recommendations"":{""textColor"":""#000000"",""textPosition"":{""vertical"":""lower-third"",""horizontal"":""left""},""needsTextShadow"":false,""productOverlaySafe"":true,""needsTextBackground"":true,""productOverlayPosition"":{""x"":""left"",""y"":""bottom""}}},""duration"":7,""narration"":""Tired of feeling tired? Struggling with symptoms that no one seems to understand?"",""background"":{""type"":""video"",""effect"":{""type"":""ken-burns"",""direction"":""in"",""intensity"":""subtle""},""source"":""Elegant woman in her 40s sitting by a large window with soft natural lighting, looking contemplative and slightly weary, wearing luxurious loungewear in neutral tones, minimalist modern interior with plants"",""overlay"":{""type"":""gradient"",""color"":""#000000"",""opacity"":0.4},""videoUrl"":""https://remotionlambda-useast1-refjo5giq5.s3.us-east-1.amazonaws.com/ai-videos/kling-2.6/1769285368671_n5x4w3esn.mp4""},""qualityTier"":""premium"",""searchQuery"":"""",""soundDesign"":{""sceneId"":""scene_001_hook"",""transitionOut"":{""url"":""https://remotionlambda-useast1-refjo5giq5.s3.us-east-1.amazonaws.com/stock-sounds/whoosh-dramatic.mp3"",""type"":""whoosh"",""volume"":0.6,""duration"":0.8}},""productMatch"":null,""qualityScore"":80,""serviceMatch"":null,""textOverlays"":[{""id"":""text_scene_001_hook_0"",""text"":""Tired of Feeling Tired?"",""style"":""headline"",""timing"":{""startAt"":0,""duration"":3},""position"":{""padding"":60,""vertical"":""lower-third"",""horizontal"":""center""},""animation"":{""exit"":""fade"",""enter"":""slide-up"",""duration"":0.5}},{""id"":""text_scene_001_hook_1"",""text"":""You're Not Alone"",""style"":""subtitle"",""timing"":{""startAt"":3,""duration"":3},""position"":{""padding"":60,""vertical"":""lower-third"",""horizontal"":""center""},""animation"":{""exit"":""fade"",""enter"":""slide-up"",""duration"":0.5}}],""transitionIn"":{""type"":""fade"",""easing"":""ease-in-out"",""duration"":0.6},""brandOverlays"":{""sceneId"":""scene_001_hook"",""overlays"":[]},""fallbackQuery"":"""",""overlayConfig"":{""logo"":{""size"":""medium"",""enabled"":true,""logoUrl"":""/api/brand-assets/file/18"",""logoName"":""Dark Logo"",""position"":""top-left"",""showTagline"":false,""sizePercent"":25},""texts"":[],""watermark"":{""enabled"":true,""opacity"":70,""position"":""bottom-right"",""sizePercent"":15},""lowerThirds"":[],""additionalLogos"":[]},""transitionOut"":{""type"":""fade"",""easing"":""ease-in-out"",""duration"":0.5},""analysisResult"":{""issues"":[],""sceneIndex"":0,""overallScore"":80,""analysisModel"":""claude-sonnet-4-20250514"",""frameAnalysis"":{""faceRegion"":{""x"":0.6,""y"":0.25,""width"":0.25,""height"":0.35},""busyRegions"":[""left""],""faceDetected"":true,""lightingType"":""warm"",""safeTextZones"":[{""position"":""lower-third"",""confidence"":85},{""position"":""top"",""confidence"":75}],""dominantColors"":[""beige"",""cream"",""warm neutral"",""green""],""subjectPosition"":""right""},""improvedPrompt"":"""",""recommendation"":""needs_review"",""technicalScore"":17,""compositionScore"":17,""aiArtifactDetails"":[],""analysisTimestamp"":""2026-01-24T20:17:34.954Z"",""contentMatchScore"":30,""aiArtifactsDetected"":false,""contentMatchDetails"":""Image shows an elegant woman appearing to be in her 50s-60s (close to requested 40s) sitting by a large window with soft natural lighting, looking contemplative. She's wearing neutral-toned clothing (beige sweater). The interior is minimalist and modern with plants visible. The contemplative expression matches the 'slightly weary' requirement. Minor deduction for age appearing slightly older than specified 40s."",""brandComplianceScore"":16,""brandComplianceDetails"":""""},""conditionMatch"":null,""visualDirection"":""Elegant woman in her 40s sitting by a large window with soft natural lighting, looking contemplative and slightly weary, wearing luxurious loungewear in neutral tones, minimalist modern interior with plants"",""brandOpportunity"":null,""audienceResonance"":null,""compositionInstructions"":{""sceneId"":""scene_001_hook"",""kenBurns"":{""easing"":""ease-in-out"",""enabled"":true,""endScale"":1.08,""startScale"":1,""endPosition"":{""x"":70,""y"":40},""startPosition"":{""x"":50,""y"":50}},""textOverlays"":[{""text"":""Tired of Feeling Tired?"",""style"":{""color"":""#000000"",""padding"":""8px 16px"",""fontSize"":56,""fontWeight"":""600"",""backgroundColor"":""rgba(0,0,0,0.6)""},""position"":{""x"":15,""y"":82,""anchor"":""bottom-left""},""animation"":{""exit"":""fade"",""enter"":""slide-up"",""enterDelay"":0,""exitDuration"":0.3,""enterDuration"":0.5}},{""text"":""You're Not Alone"",""style"":{""color"":""#000000"",""padding"":""8px 16px"",""fontSize"":36,""fontWeight"":""500"",""backgroundColor"":""rgba(0,0,0,0.6)""},""position"":{""x"":15,""y"":90,""anchor"":""bottom-left""},""animation"":{""exit"":""fade"",""enter"":""fade"",""enterDelay"":0.15,""exitDuration"":0.3,""enterDuration"":0.5}}],""transitionIn"":{""type"":""fade"",""easing"":""ease-out"",""duration"":0.8},""transitionOut"":{""type"":""fade"",""easing"":""ease-in"",""duration"":0.5}}},{""id"":""scene_002_benefit"",""type"":""benefit"",""order"":2,""assets"":{""imageUrl"":""https://remotionlambda-useast1-refjo5giq5.s3.us-east-1.amazonaws.com/video-assets/images/content_scene_002_benefit_1769285813821.jpg"",""videoUrl"":""https://remotionlambda-useast1-refjo5giq5.s3.us-east-1.amazonaws.com/ai-videos/kling-2.6/1769285493215_9gftwf1ny.mp4"",""videoSource"":""kling-2.6"",""productOverlayPosition"":{""x"":""right"",""y"":""bottom"",""scale"":0.25,""animation"":""fade""}},""analysis"":{""mood"":""positive"",""faces"":{""count"":2,""detected"":true,""positions"":[{""x"":15,""y"":25,""width"":25,""height"":35},{""x"":55,""y"":30,""width"":20,""height"":30}]},""safeZones"":{""topLeft"":true,""topRight"":true,""topCenter"":true,""bottomLeft"":true,""middleLeft"":false,""bottomRight"":true,""middleRight"":false,""bottomCenter"":true,""middleCenter"":false},""composition"":{""brightness"":""bright"",""focalPoint"":{""x"":40,""y"":45},""dominantColors"":[""#6B9BD2"",""#D4A574"",""#F5F5F5""]},""contentType"":""person"",""recommendations"":{""textColor"":""#000000"",""textPosition"":{""vertical"":""lower-third"",""horizontal"":""left""},""needsTextShadow"":false,""productOverlaySafe"":true,""needsTextBackground"":true,""productOverlayPosition"":{""x"":""right"",""y"":""bottom""}}},""duration"":13,""narration"":""At Pine Hill Farm, we don't just treat symptoms. We dig deeper to uncover the root causes of your fatigue, hormone imbalances, and gut issues."",""background"":{""type"":""video"",""effect"":{""type"":""ken-burns"",""direction"":""out"",""intensity"":""subtle""},""source"":""Sophisticated functional medicine consultation room with a professional nurse practitioner reviewing personalized health charts and lab results with a client, warm lighting, natural wood furniture, plants, clean modern aesthetic"",""overlay"":{""type"":""gradient"",""color"":""#000000"",""opacity"":0.4},""videoUrl"":""https://remotionlambda-useast1-refjo5giq5.s3.us-east-1.amazonaws.com/ai-videos/kling-2.6/1769285493215_9gftwf1ny.mp4""},""searchQuery"":"""",""soundDesign"":{""sceneId"":""scene_002_benefit"",""transitionIn"":{""url"":""https://remotionlambda-useast1-refjo5giq5.s3.us-east-1.amazonaws.com/stock-sounds/whoosh-medium.mp3"",""type"":""whoosh"",""volume"":0.6,""duration"":0.8},""transitionOut"":{""url"":""https://remotionlambda-useast1-refjo5giq5.s3.us-east-1.amazonaws.com/stock-sounds/whoosh-medium.mp3"",""type"":""whoosh"",""volume"":0.6,""duration"":0.8}},""productMatch"":null,""qualityScore"":89,""serviceMatch"":null,""textOverlays"":[{""id"":""text_scene_002_benefit_0"",""text"":""Root Cause Solutions"",""style"":""title"",""timing"":{""startAt"":0,""duration"":4},""position"":{""padding"":60,""vertical"":""center"",""horizontal"":""center""},""animation"":{""exit"":""fade"",""enter"":""fade"",""duration"":0.5}},{""id"":""text_scene_002_benefit_1"",""text"":""Not Just Symptom Management"",""style"":""subtitle"",""timing"":{""startAt"":4,""duration"":4},""position"":{""padding"":60,""vertical"":""lower-third"",""horizontal"":""center""},""animation"":{""exit"":""fade"",""enter"":""slide-up"",""duration"":0.5}}],""transitionIn"":{""type"":""slide"",""easing"":""ease-in-out"",""duration"":0.6},""brandOverlays"":{""sceneId"":""scene_002_benefit"",""overlays"":[]},""fallbackQuery"":"""",""transitionOut"":{""type"":""fade"",""easing"":""ease-in-out"",""duration"":0.5},""analysisResult"":{""issues"":[],""sceneIndex"":1,""overallScore"":89,""analysisModel"":""claude-sonnet-4-20250514"",""frameAnalysis"":{""faceRegion"":{""x"":0.2,""y"":0.15,""width"":0.6,""height"":0.4},""busyRegions"":[""center""],""faceDetected"":true,""lightingType"":""warm"",""safeTextZones"":[{""position"":""lower-third"",""confidence"":85},{""position"":""top"",""confidence"":75}],""dominantColors"":[""warm brown"",""natural wood"",""green plants"",""warm whites""],""subjectPosition"":""center""},""improvedPrompt"":"""",""recommendation"":""approved"",""technicalScore"":17,""compositionScore"":17,""aiArtifactDetails"":[],""analysisTimestamp"":""2026-01-24T20:17:44.483Z"",""contentMatchScore"":37,""aiArtifactsDetected"":false,""contentMatchDetails"":""Excellent match to visual direction. Shows sophisticated functional medicine consultation room with nurse practitioner (white coat, stethoscope) reviewing health charts/lab results with male client. Natural wood furniture visible, plants present, warm lighting, clean modern aesthetic all match requirements."",""brandComplianceScore"":18,""brandComplianceDetails"":""""},""conditionMatch"":null,""visualDirection"":""Sophisticated functional medicine consultation room with a professional nurse practitioner reviewing personalized health charts and lab results with a client, warm lighting, natural wood furniture, plants, clean modern aesthetic"",""brandOpportunity"":null,""audienceResonance"":null,""compositionInstructions"":{""sceneId"":""scene_002_benefit"",""kenBurns"":{""easing"":""linear"",""enabled"":true,""endScale"":1.05,""startScale"":1.05,""endPosition"":{""x"":65,""y"":45},""startPosition"":{""x"":27.5,""y"":42.5}},""textOverlays"":[{""text"":""Root Cause Solutions"",""style"":{""color"":""#000000"",""padding"":""8px 16px"",""fontSize"":72,""fontWeight"":""700"",""backgroundColor"":""rgba(0,0,0,0.6)""},""position"":{""x"":15,""y"":82,""anchor"":""bottom-left""},""animation"":{""exit"":""fade"",""enter"":""fade"",""enterDelay"":0,""exitDuration"":0.3,""enterDuration"":0.5}},{""text"":""Not Just Symptom Management"",""style"":{""color"":""#000000"",""padding"":""8px 16px"",""fontSize"":36,""fontWeight"":""500"",""backgroundColor"":""rgba(0,0,0,0.6)""},""position"":{""x"":15,""y"":90,""anchor"":""bottom-left""},""animation"":{""exit"":""fade"",""enter"":""fade"",""enterDelay"":0.15,""exitDuration"":0.3,""enterDuration"":0.5}}],""transitionIn"":{""type"":""fade"",""easing"":""ease-out"",""duration"":0.5},""transitionOut"":{""type"":""fade"",""easing"":""ease-in"",""duration"":0.5}}},{""id"":""scene_003_benefit"",""type"":""benefit"",""order"":3,""assets"":{""imageUrl"":""https://remotionlambda-useast1-refjo5giq5.s3.us-east-1.amazonaws.com/video-assets/images/content_scene_003_benefit_1769285814266.jpg"",""videoUrl"":""https://remotionlambda-useast1-refjo5giq5.s3.us-east-1.amazonaws.com/ai-videos/kling-2.6/1769285618335_eehzenhib.mp4"",""videoSource"":""kling-2.6"",""productOverlayUrl"":""https://remotionlambda-useast1-refjo5giq5.s3.us-east-1.amazonaws.com/video-assets/product_scene_2_1769285915054.png"",""useProductOverlay"":true,""productOverlayPosition"":{""x"":""right"",""y"":""bottom"",""scale"":0.25,""animation"":""fade""}},""analysis"":{""mood"":""positive"",""faces"":{""count"":2,""detected"":true,""positions"":[{""x"":15,""y"":25,""width"":25,""height"":35},{""x"":55,""y"":25,""width"":25,""height"":35}]},""safeZones"":{""topLeft"":true,""topRight"":true,""topCenter"":false,""bottomLeft"":true,""middleLeft"":false,""bottomRight"":true,""middleRight"":false,""bottomCenter"":true,""middleCenter"":false},""composition"":{""brightness"":""bright"",""focalPoint"":{""x"":50,""y"":40},""dominantColors"":[""#f5f1ed"",""#e8d7c8"",""#c4a687""]},""contentType"":""person"",""recommendations"":{""textColor"":""#000000"",""textPosition"":{""vertical"":""lower-third"",""horizontal"":""center""},""needsTextShadow"":false,""productOverlaySafe"":true,""needsTextBackground"":false,""productOverlayPosition"":{""x"":""right"",""y"":""bottom""}}},""duration"":11,""narration"":""With convenient at-home lab testing and personalized guidance from our functional nurse, you'll finally get the answers you've been searching for."",""background"":{""type"":""video"",""effect"":{""type"":""ken-burns"",""direction"":""in"",""intensity"":""subtle""},""source"":""Elegant at-home scene showing a woman easily collecting lab samples with professional testing kit on marble countertop, then seamlessly transitioning to virtual consultation on laptop with caring healthcare provider"",""overlay"":{""type"":""gradient"",""color"":""#000000"",""opacity"":0.4},""videoUrl"":""https://remotionlambda-useast1-refjo5giq5.s3.us-east-1.amazonaws.com/ai-videos/kling-2.6/1769285618335_eehzenhib.mp4""},""searchQuery"":"""",""soundDesign"":{""sceneId"":""scene_003_benefit"",""transitionIn"":{""url"":""https://remotionlambda-useast1-refjo5giq5.s3.us-east-1.amazonaws.com/stock-sounds/whoosh-medium.mp3"",""type"":""whoosh"",""volume"":0.6,""duration"":0.8},""transitionOut"":{""url"":""https://remotionlambda-useast1-refjo5giq5.s3.us-east-1.amazonaws.com/stock-sounds/whoosh-medium.mp3"",""type"":""whoosh"",""volume"":0.6,""duration"":0.8}},""productMatch"":null,""qualityScore"":74,""serviceMatch"":null,""textOverlays"":[{""id"":""text_scene_003_benefit_0"",""text"":""At-Home Lab Testing"",""style"":""bullet"",""timing"":{""startAt"":0,""duration"":4},""position"":{""padding"":60,""vertical"":""lower-third"",""horizontal"":""center""},""animation"":{""exit"":""fade"",""enter"":""slide-up"",""duration"":0.5}},{""id"":""text_scene_003_benefit_1"",""text"":""Personalized Guidance"",""style"":""bullet"",""timing"":{""startAt"":4,""duration"":4},""position"":{""padding"":60,""vertical"":""lower-third"",""horizontal"":""center""},""animation"":{""exit"":""fade"",""enter"":""slide-up"",""duration"":0.5}}],""transitionIn"":{""type"":""slide"",""easing"":""ease-in-out"",""duration"":0.6},""brandAnalysis"":{""sceneType"":""product-in-context"",""confidence"":0.6000000000000001,""logoRequired"":false,""matchedLogoCount"":0,""productVisibility"":""visible"",""matchedProductCount"":3},""brandOverlays"":{""sceneId"":""scene_003_benefit"",""overlays"":[]},""fallbackQuery"":"""",""transitionOut"":{""type"":""fade"",""easing"":""ease-in-out"",""duration"":0.5},""analysisResult"":{""issues"":[{""category"":""content_match"",""severity"":""major"",""suggestion"":""Regenerate to include this element"",""description"":""Missing required element: virtual consultation on laptop""},{""category"":""content_match"",""severity"":""major"",""suggestion"":""Regenerate to include this element"",""description"":""Missing required element: healthcare provider""},{""category"":""brand_compliance"",""severity"":""major"",""suggestion"":""Adjust to match Pine Hill Farm aesthetic (warm lighting, earth tones)"",""description"":""Setting is somewhat clinical/sterile kitchen rather than warm, natural farm-inspired environment""}],""sceneIndex"":2,""overallScore"":74,""analysisModel"":""claude-sonnet-4-20250514"",""frameAnalysis"":{""faceRegion"":{""x"":0.6,""y"":0.2,""width"":0.15,""height"":0.2},""busyRegions"":[""center""],""faceDetected"":true,""lightingType"":""warm"",""safeTextZones"":[{""position"":""lower-third"",""confidence"":85},{""position"":""top"",""confidence"":70}],""dominantColors"":[""white"",""cream"",""gray"",""green""],""subjectPosition"":""center""},""improvedPrompt"":""Elegant at-home scene showing split screen or sequential shots: woman easily collecting lab samples with professional testing kit on marble countertop, then cut to her having virtual consultation on laptop screen showing caring healthcare provider in warm, welcoming setting"",""recommendation"":""needs_review"",""technicalScore"":17,""compositionScore"":16,""aiArtifactDetails"":[],""analysisTimestamp"":""2026-01-24T20:17:55.735Z"",""contentMatchScore"":26,""aiArtifactsDetected"":false,""contentMatchDetails"":""Image shows woman collecting lab samples with testing kit on marble countertop, which matches first part of visual direction. However, the 'seamlessly transitioning to virtual consultation on laptop with caring healthcare provider' element is completely missing. The scene only captures the lab sample collection portion."",""brandComplianceScore"":15,""brandComplianceDetails"":""Setting is somewhat clinical/sterile kitchen rather than warm, natural farm-inspired environment""},""conditionMatch"":null,""visualDirection"":""Elegant at-home scene showing a woman easily collecting lab samples with professional testing kit on marble countertop, then seamlessly transitioning to virtual consultation on laptop with caring healthcare provider"",""brandOpportunity"":null,""audienceResonance"":null,""compositionInstructions"":{""sceneId"":""scene_003_benefit"",""kenBurns"":{""easing"":""linear"",""enabled"":true,""endScale"":1.05,""startScale"":1.05,""endPosition"":{""x"":67.5,""y"":42.5},""startPosition"":{""x"":27.5,""y"":42.5}},""textOverlays"":[{""text"":""At-Home Lab Testing"",""style"":{""color"":""#000000"",""fontSize"":36,""fontWeight"":""500""},""position"":{""x"":50,""y"":82,""anchor"":""bottom-center""},""animation"":{""exit"":""fade"",""enter"":""fade"",""enterDelay"":0,""exitDuration"":0.3,""enterDuration"":0.5}},{""text"":""Personalized Guidance"",""style"":{""color"":""#000000"",""fontSize"":36,""fontWeight"":""500""},""position"":{""x"":50,""y"":90,""anchor"":""bottom-center""},""animation"":{""exit"":""fade"",""enter"":""fade"",""enterDelay"":0.15,""exitDuration"":0.3,""enterDuration"":0.5}}],""transitionIn"":{""type"":""dissolve"",""easing"":""linear"",""duration"":0.4},""transitionOut"":{""type"":""fade"",""easing"":""ease-in"",""duration"":0.5},""productOverlay"":{""scale"":0.2,""shadow"":true,""enabled"":true,""position"":{""x"":90,""y"":90,""anchor"":""bottom-right""},""animation"":""fade""}}},{""id"":""scene_004_cta"",""type"":""cta"",""order"":4,""assets"":{""imageUrl"":""https://remotionlambda-useast1-refjo5giq5.s3.us-east-1.amazonaws.com/video-assets/images/content_scene_004_cta_1769285814503.jpg"",""videoUrl"":""https://remotionlambda-useast1-refjo5giq5.s3.us-east-1.amazonaws.com/ai-videos/runway/1769285658628_4fpavwqpn.mp4"",""videoSource"":""runway"",""productOverlayPosition"":{""x"":""center"",""y"":""center"",""scale"":0.5,""animation"":""zoom""}},""analysis"":{""mood"":""positive"",""faces"":{""count"":1,""detected"":true,""positions"":[{""x"":35,""y"":25,""width"":30,""height"":40}]},""safeZones"":{""topLeft"":true,""topRight"":true,""topCenter"":false,""bottomLeft"":true,""middleLeft"":true,""bottomRight"":true,""middleRight"":false,""bottomCenter"":true,""middleCenter"":false},""composition"":{""brightness"":""bright"",""focalPoint"":{""x"":50,""y"":45},""dominantColors"":[""#F4D03F"",""#E8C547"",""#D4AC0D""]},""contentType"":""person"",""recommendations"":{""textColor"":""#000000"",""textPosition"":{""vertical"":""lower-third"",""horizontal"":""center""},""needsTextShadow"":false,""productOverlaySafe"":true,""needsTextBackground"":false,""productOverlayPosition"":{""x"":""left"",""y"":""bottom""}}},""duration"":15,""narration"":""Your health journey is unique, and your care should be too. Visit pinehillfarm.co to start your wellness journey today."",""background"":{""type"":""video"",""effect"":{""type"":""ken-burns"",""direction"":""out"",""intensity"":""subtle""},""source"":""Confident, vibrant woman in her 40s walking through a beautiful pine forest or farm landscape at golden hour, looking healthy and energized, wearing flowing natural fabrics, peaceful and luxurious outdoor setting"",""overlay"":{""type"":""gradient"",""color"":""#000000"",""opacity"":0.4},""videoUrl"":""https://remotionlambda-useast1-refjo5giq5.s3.us-east-1.amazonaws.com/ai-videos/runway/1769285658628_4fpavwqpn.mp4""},""searchQuery"":"""",""soundDesign"":{""sceneId"":""scene_004_cta"",""transitionIn"":{""url"":""https://remotionlambda-useast1-refjo5giq5.s3.us-east-1.amazonaws.com/stock-sounds/whoosh-dramatic.mp3"",""type"":""whoosh"",""volume"":0.6,""duration"":0.8}},""productMatch"":null,""qualityScore"":81,""serviceMatch"":null,""textOverlays"":[{""id"":""text_scene_004_cta_0"",""text"":""Your Wellness Journey Starts Here"",""style"":""title"",""timing"":{""startAt"":0,""duration"":4},""position"":{""padding"":60,""vertical"":""center"",""horizontal"":""center""},""animation"":{""exit"":""fade"",""enter"":""fade"",""duration"":0.5}},{""id"":""text_scene_004_cta_1"",""text"":""Visit pinehillfarm.co"",""style"":""cta"",""timing"":{""startAt"":4,""duration"":4},""position"":{""padding"":60,""vertical"":""lower-third"",""horizontal"":""center""},""animation"":{""exit"":""fade"",""enter"":""slide-up"",""duration"":0.5}},{""id"":""cta-3"",""text"":""Visit pinehillfarm"",""style"":""cta"",""timing"":{""startAt"":4.5,""duration"":10.5},""position"":{""padding"":24,""vertical"":""bottom"",""horizontal"":""center""},""animation"":{""exit"":""fade"",""enter"":""scale"",""duration"":0.4}},{""id"":""cta-sub-3-0"",""text"":""pinehillfarm.co"",""style"":""caption"",""timing"":{""startAt"":6,""duration"":9},""position"":{""padding"":24,""vertical"":""bottom"",""horizontal"":""center""},""animation"":{""exit"":""fade"",""enter"":""fade"",""duration"":0.3}}],""transitionIn"":{""type"":""zoom"",""easing"":""ease-in-out"",""duration"":0.6},""brandOverlays"":{""ctaText"":{""url"":""PineHillFarm.com"",""subtext"":""Natural solutions for lasting health"",""headline"":""Start Your Wellness Journey Today""},""sceneId"":""scene_004_cta"",""overlays"":[]},""fallbackQuery"":"""",""overlayConfig"":{""logo"":{""size"":""medium"",""enabled"":true,""logoUrl"":""/api/brand-assets/file/18"",""logoName"":""Dark Logo"",""position"":""top-right"",""showTagline"":true,""sizePercent"":25},""texts"":[],""watermark"":{""enabled"":true,""opacity"":70,""position"":""bottom-right"",""sizePercent"":15},""lowerThirds"":[],""additionalLogos"":[{""id"":""cert-1769285210820"",""size"":""small"",""type"":""partner"",""logoUrl"":""/api/brand-assets/file/14"",""opacity"":90,""logoName"":""American Holistic Nurses Association Logo"",""position"":""bottom-left"",""sizePercent"":12},{""id"":""cert-1769285211355"",""size"":""small"",""type"":""partner"",""logoUrl"":""/api/brand-assets/file/15"",""opacity"":90,""logoName"":""The Menopause Society Logo"",""position"":""top-right"",""sizePercent"":12},{""id"":""cert-1769285214943"",""size"":""small"",""type"":""trust"",""logoUrl"":""/api/brand-assets/file/17"",""opacity"":90,""logoName"":""Women Owned Logo"",""position"":""bottom-right"",""sizePercent"":12}]},""transitionOut"":{""type"":""fade"",""easing"":""ease-in-out"",""duration"":0.5},""analysisResult"":{""issues"":[{""category"":""content_match"",""severity"":""major"",""suggestion"":""Regenerate to include this element"",""description"":""Missing required element: specific pine forest or farm landscape""},{""category"":""technical"",""severity"":""minor"",""suggestion"":""Regenerate for better quality"",""description"":""slight motion blur in hair""}],""sceneIndex"":3,""overallScore"":81,""analysisModel"":""claude-sonnet-4-20250514"",""frameAnalysis"":{""faceRegion"":{""x"":0.45,""y"":0.15,""width"":0.15,""height"":0.2},""busyRegions"":[""top""],""faceDetected"":true,""lightingType"":""warm"",""safeTextZones"":[{""position"":""lower-third"",""confidence"":85},{""position"":""bottom-left"",""confidence"":75}],""dominantColors"":[""warm gold"",""earthy brown"",""forest green""],""subjectPosition"":""center""},""improvedPrompt"":""Confident, vibrant woman in her 40s walking through a clearly identifiable pine forest with visible pine trees or farm landscape with rustic farm elements at golden hour, looking healthy and energized, wearing flowing natural fabrics, peaceful and luxurious outdoor setting"",""recommendation"":""needs_review"",""technicalScore"":17,""compositionScore"":16,""aiArtifactDetails"":[],""analysisTimestamp"":""2026-01-24T20:18:06.904Z"",""contentMatchScore"":30,""aiArtifactsDetected"":false,""contentMatchDetails"":""Image shows a confident woman in her 40s-50s in a natural outdoor setting with golden hour lighting, wearing flowing natural fabrics. However, the setting appears to be a general forest/wooded area rather than specifically a pine forest or farm landscape as requested. The woman appears healthy and energized with an authentic smile."",""brandComplianceScore"":18,""brandComplianceDetails"":""""},""conditionMatch"":null,""visualDirection"":""Confident, vibrant woman in her 40s walking through a beautiful pine forest or farm landscape at golden hour, looking healthy and energized, wearing flowing natural fabrics, peaceful and luxurious outdoor setting"",""brandOpportunity"":null,""audienceResonance"":null,""compositionInstructions"":{""sceneId"":""scene_004_cta"",""kenBurns"":{""easing"":""linear"",""enabled"":true,""endScale"":1.06,""startScale"":1,""endPosition"":{""x"":50,""y"":45},""startPosition"":{""x"":50,""y"":50}},""textOverlays"":[{""text"":""Your Wellness Journey Starts Here"",""style"":{""color"":""#000000"",""fontSize"":72,""fontWeight"":""700""},""position"":{""x"":50,""y"":82,""anchor"":""bottom-center""},""animation"":{""exit"":""fade"",""enter"":""fade"",""enterDelay"":0,""exitDuration"":0.3,""enterDuration"":0.5}},{""text"":""Visit pinehillfarm.co"",""style"":{""color"":""#000000"",""fontSize"":36,""fontWeight"":""500""},""position"":{""x"":50,""y"":90,""anchor"":""bottom-center""},""animation"":{""exit"":""fade"",""enter"":""fade"",""enterDelay"":0.15,""exitDuration"":0.3,""enterDuration"":0.5}}],""transitionIn"":{""type"":""zoom"",""easing"":""ease-out"",""duration"":0.6},""transitionOut"":{""type"":""fade"",""easing"":""ease-in"",""duration"":1}}}]","{""music"":{""url"":""https://remotionlambda-useast1-refjo5giq5.s3.us-east-1.amazonaws.com/video-assets/music/proj_1769285135903_qbf15mkbz_1769285913886.mp3"",""volume"":0.2,""duration"":46},""images"":[{""url"":""https://v3b.fal.media/files/b/0a8bb70f/2bR7_8pGxCTJvI9tsQwMY_7e652ece2cd7482c947313bedf5c4e7e.jpg"",""prompt"":""Elegant woman in her 40s sitting by a large window with soft natural lighting, looking contemplative and slightly weary, wearing luxurious loungewear in neutral tones, minimalist modern interior with plants"",""source"":""ai"",""sceneId"":""scene_001_hook""},{""url"":""https://v3b.fal.media/files/b/0a8bb70f/bipSuer6ORPiSeOwbQA0f_2c1acb692fd341f682888629f98d0263.jpg"",""prompt"":""Sophisticated functional medicine consultation room with a professional nurse practitioner reviewing personalized health charts and lab results with a client, warm lighting, natural wood furniture, plants, clean modern aesthetic"",""source"":""ai"",""sceneId"":""scene_002_benefit""},{""url"":""https://v3b.fal.media/files/b/0a8bb710/7wstKBh65OR1G-Cwq7nr1_b7cf56b071e44bfbb729717afbdb7b4a.jpg"",""prompt"":""Elegant at-home scene showing a woman easily collecting lab samples with professional testing kit on marble countertop, then seamlessly transitioning to virtual consultation on laptop with caring healthcare provider"",""source"":""ai"",""sceneId"":""scene_003_benefit""},{""url"":""https://v3b.fal.media/files/b/0a8bb710/6EwaONHmFvkOVeSw7gqbi_2a5b90320c8c400c9e4d666cc3cf198b.jpg"",""prompt"":""Confident, vibrant woman in her 40s walking through a beautiful pine forest or farm landscape at golden hour, looking healthy and energized, wearing flowing natural fabrics, peaceful and luxurious outdoor setting"",""source"":""ai"",""sceneId"":""scene_004_cta""}],""videos"":[{""url"":""https://remotionlambda-useast1-refjo5giq5.s3.us-east-1.amazonaws.com/ai-videos/kling-2.6/1769285368671_n5x4w3esn.mp4"",""source"":""kling-2.6"",""sceneId"":""scene_001_hook""},{""url"":""https://remotionlambda-useast1-refjo5giq5.s3.us-east-1.amazonaws.com/ai-videos/kling-2.6/1769285493215_9gftwf1ny.mp4"",""source"":""kling-2.6"",""sceneId"":""scene_002_benefit""},{""url"":""https://remotionlambda-useast1-refjo5giq5.s3.us-east-1.amazonaws.com/ai-videos/kling-2.6/1769285618335_eehzenhib.mp4"",""source"":""kling-2.6"",""sceneId"":""scene_003_benefit""},{""url"":""https://remotionlambda-useast1-refjo5giq5.s3.us-east-1.amazonaws.com/ai-videos/runway/1769285658628_4fpavwqpn.mp4"",""source"":""runway"",""sceneId"":""scene_004_cta""}],""voiceover"":{""duration"":33,""perScene"":[],""fullTrackUrl"":""https://remotionlambda-useast1-refjo5giq5.s3.us-east-1.amazonaws.com/video-assets/voiceover/proj_1769285135903_qbf15mkbz_1769285913405.mp3""},""productImages"":[]}","{""steps"":{""music"":{""status"":""complete"",""message"":""Generated 46s background music (elevenlabs-music)"",""progress"":100},""images"":{""status"":""complete"",""progress"":100},""script"":{""status"":""complete"",""message"":""Generated 4 scenes"",""progress"":100},""videos"":{""status"":""complete"",""message"":""Generated 4 AI videos, 0 stock clips"",""progress"":100},""assembly"":{""status"":""in-progress"",""message"":""Analyzing scenes with AI vision..."",""progress"":100},""rendering"":{""status"":""complete"",""message"":""Render started: fzjupn4nem"",""progress"":100},""voiceover"":{""status"":""complete"",""progress"":100}},""errors"":[],""currentStep"":""rendering"",""renderMethod"":""standard"",""overallPercent"":100,""renderStartedAt"":1769285917994,""serviceFailures"":[],""lastProgressValue"":90,""lastProgressUpdateAt"":1769286487023}","complete","fzjupn4nem","remotionlambda-useast1-refjo5giq5","https://s3.us-east-1.amazonaws.com/remotionlambda-useast1-refjo5giq5/renders/fzjupn4nem/out.mp4","""2026-01-24T20:05:49.515Z""","""2026-01-24T20:28:12.483Z""",,"{""sceneScores"":[{""score"":85,""issues"":[],""status"":""approved"",""sceneIndex"":0,""autoApproved"":true,""userApproved"":false,""regenerationCount"":0},{""score"":85,""issues"":[],""status"":""approved"",""sceneIndex"":1,""autoApproved"":true,""userApproved"":false,""regenerationCount"":0},{""score"":85,""issues"":[],""status"":""approved"",""sceneIndex"":2,""autoApproved"":true,""userApproved"":false,""regenerationCount"":0},{""score"":85,""issues"":[],""status"":""approved"",""sceneIndex"":3,""autoApproved"":true,""userApproved"":false,""regenerationCount"":0}],""overallScore"":85,""overallIssues"":[],""criticalIssues"":[]}","premium"
